{
  "seed": 101,
  "settingsOverrides": {
    "roundDuration": 2,
    "laserStartTime": 2,
    "laserWarningDuration": 1.1666666666666667,
    "laserStepInterval": 10
  },
  "inputs": [
    {
      "t": 0,
      "player": "p1",
      "dir": "UP"
    },
    {
      "t": 0.2,
      "player": "p1",
      "dir": "LEFT"
    }
  ],
  "expectedEvents": [
    {
      "type": "FOOD_SPAWNED",
      "tick": 0,
      "t": 0,
      "index": 0,
      "cell": {
        "x": 3,
        "y": 4
      }
    },
    {
      "type": "FOOD_SPAWNED",
      "tick": 0,
      "t": 0,
      "index": 1,
      "cell": {
        "x": 18,
        "y": 18
      }
    },
    {
      "type": "FOOD_SPAWNED",
      "tick": 0,
      "t": 0,
      "index": 2,
      "cell": {
        "x": 12,
        "y": 20
      }
    },
    {
      "type": "FOOD_SPAWNED",
      "tick": 0,
      "t": 0,
      "index": 3,
      "cell": {
        "x": 15,
        "y": 12
      }
    },
    {
      "type": "LASER_WARNING",
      "tick": 1,
      "t": 0.008333333333333333
    },
    {
      "type": "LASER_STEP",
      "tick": 140,
      "t": 1.1666666666666667,
      "inset": 1
    },
    {
      "type": "SNAKE_DIED",
      "tick": 140,
      "t": 1.1666666666666667,
      "snakeId": "p1",
      "cause": "LASER",
      "cell": {
        "x": 0,
        "y": 13
      }
    },
    {
      "type": "ROUND_OVER",
      "tick": 140,
      "t": 1.1666666666666667,
      "result": "P2_WIN",
      "reason": "DEATH",
      "winnerId": "p2",
      "lengths": [4, 4]
    }
  ]
}
